{
  "$schema": "https://json-schema.org/draft/2020-12/schema",
  "additionalProperties": false,
  "properties": {
    "checks": {
      "items": {
        "additionalProperties": false,
        "properties": {
          "description": {
            "minLength": 1,
            "type": "string"
          },
          "details": {},
          "id": {
            "minLength": 1,
            "type": "string"
          },
          "status": {
            "enum": [
              "PASS",
              "FAIL"
            ],
            "type": "string"
          }
        },
        "required": [
          "id",
          "description",
          "status",
          "details"
        ],
        "type": "object"
      },
      "minItems": 1,
      "type": "array"
    },
    "git_sha": {
      "minLength": 7,
      "type": "string"
    },
    "status": {
      "enum": [
        "PASS",
        "FAIL"
      ],
      "type": "string"
    },
    "task_id": {
      "const": "R-015",
      "minLength": 1,
      "type": "string"
    },
    "test_project_exists": {
      "type": [
        "string",
        "number",
        "integer",
        "boolean",
        "object",
        "array",
        "null"
      ]
    },
    "tests_passed": {
      "type": "boolean"
    },
    "timestamp_utc": {
      "format": "date-time",
      "type": "string"
    }
  },
  "required": [
    "task_id",
    "git_sha",
    "timestamp_utc",
    "status",
    "checks",
    "test_project_exists",
    "tests_passed"
  ],
  "title": "R-015 Tests Bootstrap Evidence",
  "type": "object"
}